{"certificate":{"candidate_reduced_choi_signature":["+Y__Z_ZX","+_X___Z_","+ZZZY_XZ","+ZZZZYXX"],"compiler_declared_valid":true,"logical_action_signature":["+YYYY","+Z_Y_","+Y_ZX","-___Y","-X_X_","-YXXY","+YZZ_","-XYX_"],"target_reduced_choi_signature":["+Y__Z_ZX","+_X___Z_","+ZZZY_XZ","+ZZZZYXX"]},"final_permutation":["E0","E1","E2","E3","A0","B0"],"format_version":"orelia.recovery-artifact/v1","logical_circuit":{"gates":[{"operation":"H","qubits":["A0"]},{"operation":"CNOT","qubits":["A0","E0"]},{"operation":"H","qubits":["E3"]},{"operation":"CNOT","qubits":["E3","E2"]},{"operation":"S","qubits":["E3"]},{"operation":"H","qubits":["E3"]},{"operation":"CNOT","qubits":["E3","B0"]},{"operation":"H","qubits":["A0"]},{"operation":"S","qubits":["B0"]},{"operation":"H","qubits":["B0"]},{"operation":"S","qubits":["B0"]},{"operation":"S","qubits":["E0"]},{"operation":"H","qubits":["E1"]},{"operation":"H","qubits":["E3"]},{"operation":"CNOT","qubits":["E0","E1"]},{"operation":"CNOT","qubits":["E0","E2"]},{"operation":"CNOT","qubits":["E0","E3"]},{"operation":"S","qubits":["E2"]},{"operation":"S","qubits":["E3"]},{"operation":"H","qubits":["E1"]},{"operation":"H","qubits":["E2"]},{"operation":"H","qubits":["E3"]},{"operation":"CNOT","qubits":["E1","E0"]},{"operation":"CNOT","qubits":["E2","E0"]},{"operation":"CNOT","qubits":["E3","E0"]},{"operation":"CNOT","qubits":["E3","E1"]},{"operation":"CNOT","qubits":["E1","E3"]},{"operation":"CNOT","qubits":["E3","E1"]},{"operation":"H","qubits":["E1"]},{"operation":"S","qubits":["E2"]},{"operation":"H","qubits":["E2"]},{"operation":"CNOT","qubits":["E2","E1"]},{"operation":"S","qubits":["E2"]},{"operation":"H","qubits":["E2"]},{"operation":"CNOT","qubits":["E3","E2"]},{"operation":"S","qubits":["E3"]},{"operation":"H","qubits":["E3"]},{"operation":"S","qubits":["E3"]},{"operation":"H","qubits":["E1"]},{"operation":"H","qubits":["E2"]},{"operation":"S","qubits":["E1"]},{"operation":"S","qubits":["E1"]},{"operation":"S","qubits":["E2"]},{"operation":"S","qubits":["E2"]},{"operation":"H","qubits":["E1"]},{"operation":"H","qubits":["E2"]},{"operation":"S","qubits":["E0"]},{"operation":"S","qubits":["E0"]},{"operation":"S","qubits":["E1"]},{"operation":"S","qubits":["E1"]},{"operation":"S","qubits":["E3"]},{"operation":"S","qubits":["E3"]}],"qubit_order":["E0","E1","E2","E3","A0","B0"]},"metrics":[{"name":"circuit_entanglement_fidelity","unit":"probability","value":"1"},{"name":"petz_entanglement_fidelity","unit":"probability","value":"1"},{"name":"reduced_choi_equal","unit":"boolean","value":"1"}],"petz_target":{"choi_qubit_order":["out:E0","ref:E0","ref:E1","ref:E2","ref:E3","ref:A0","ref:B0","env:B1","env:B2","env:B3"],"representation":"pure_stabilizer_choi_purification","signed_generators":[{"operators":"XIIIIIYYXI","phase_exponent_mod_4":2,"qubit_order":["out:E0","ref:E0","ref:E1","ref:E2","ref:E3","ref:A0","ref:B0","env:B1","env:B2","env:B3"]},{"operators":"ZIIIIZYIZY","phase_exponent_mod_4":0,"qubit_order":["out:E0","ref:E0","ref:E1","ref:E2","ref:E3","ref:A0","ref:B0","env:B1","env:B2","env:B3"]},{"operators":"IXIIIZIIII","phase_exponent_mod_4":0,"qubit_order":["out:E0","ref:E0","ref:E1","ref:E2","ref:E3","ref:A0","ref:B0","env:B1","env:B2","env:B3"]},{"operators":"IZIIIYYIXY","phase_exponent_mod_4":0,"qubit_order":["out:E0","ref:E0","ref:E1","ref:E2","ref:E3","ref:A0","ref:B0","env:B1","env:B2","env:B3"]},{"operators":"IIXIIZIYXZ","phase_exponent_mod_4":0,"qubit_order":["out:E0","ref:E0","ref:E1","ref:E2","ref:E3","ref:A0","ref:B0","env:B1","env:B2","env:B3"]},{"operators":"IIZIIIIIIY","phase_exponent_mod_4":2,"qubit_order":["out:E0","ref:E0","ref:E1","ref:E2","ref:E3","ref:A0","ref:B0","env:B1","env:B2","env:B3"]},{"operators":"IIIXIIYYII","phase_exponent_mod_4":0,"qubit_order":["out:E0","ref:E0","ref:E1","ref:E2","ref:E3","ref:A0","ref:B0","env:B1","env:B2","env:B3"]},{"operators":"IIIZIIXYYY","phase_exponent_mod_4":0,"qubit_order":["out:E0","ref:E0","ref:E1","ref:E2","ref:E3","ref:A0","ref:B0","env:B1","env:B2","env:B3"]},{"operators":"IIIIXZXXXY","phase_exponent_mod_4":2,"qubit_order":["out:E0","ref:E0","ref:E1","ref:E2","ref:E3","ref:A0","ref:B0","env:B1","env:B2","env:B3"]},{"operators":"IIIIZZXZXY","phase_exponent_mod_4":2,"qubit_order":["out:E0","ref:E0","ref:E1","ref:E2","ref:E3","ref:A0","ref:B0","env:B1","env:B2","env:B3"]}]},"resources":{"environment_qubits":0,"logical_cnot":14,"logical_depth":12,"movement_swaps":9,"restoration_swaps":9,"routed_cnot":68,"routed_depth":49},"routed_circuit":{"gates":[{"operation":"H","qubits":["E1"]},{"operation":"CNOT","qubits":["E1","E0"]},{"operation":"CNOT","qubits":["E0","E1"]},{"operation":"CNOT","qubits":["E1","E0"]},{"operation":"H","qubits":["E3"]},{"operation":"CNOT","qubits":["E3","E2"]},{"operation":"S","qubits":["E3"]},{"operation":"H","qubits":["E3"]},{"operation":"H","qubits":["A0"]},{"operation":"CNOT","qubits":["A0","E3"]},{"operation":"CNOT","qubits":["E3","A0"]},{"operation":"CNOT","qubits":["A0","E3"]},{"operation":"CNOT","qubits":["E2","E3"]},{"operation":"CNOT","qubits":["E3","E2"]},{"operation":"CNOT","qubits":["E2","E3"]},{"operation":"CNOT","qubits":["E2","E1"]},{"operation":"S","qubits":["E1"]},{"operation":"CNOT","qubits":["E1","E0"]},{"operation":"H","qubits":["E0"]},{"operation":"H","qubits":["E2"]},{"operation":"CNOT","qubits":["E2","E1"]},{"operation":"CNOT","qubits":["E1","E2"]},{"operation":"CNOT","qubits":["E2","E1"]},{"operation":"CNOT","qubits":["E1","E0"]},{"operation":"CNOT","qubits":["E0","E1"]},{"operation":"CNOT","qubits":["E1","E0"]},{"operation":"CNOT","qubits":["E2","E3"]},{"operation":"S","qubits":["E3"]},{"operation":"H","qubits":["E3"]},{"operation":"CNOT","qubits":["A0","B0"]},{"operation":"H","qubits":["A0"]},{"operation":"CNOT","qubits":["E3","A0"]},{"operation":"CNOT","qubits":["A0","E3"]},{"operation":"CNOT","qubits":["E3","A0"]},{"operation":"CNOT","qubits":["E2","E3"]},{"operation":"CNOT","qubits":["E1","E2"]},{"operation":"S","qubits":["E3"]},{"operation":"H","qubits":["E3"]},{"operation":"CNOT","qubits":["E3","E2"]},{"operation":"CNOT","qubits":["E2","E3"]},{"operation":"CNOT","qubits":["E3","E2"]},{"operation":"CNOT","qubits":["A0","E3"]},{"operation":"CNOT","qubits":["E2","E3"]},{"operation":"CNOT","qubits":["E2","E1"]},{"operation":"CNOT","qubits":["E1","E2"]},{"operation":"CNOT","qubits":["E2","E1"]},{"operation":"H","qubits":["E1"]},{"operation":"S","qubits":["E3"]},{"operation":"S","qubits":["E3"]},{"operation":"S","qubits":["A0"]},{"operation":"H","qubits":["A0"]},{"operation":"CNOT","qubits":["E3","A0"]},{"operation":"CNOT","qubits":["A0","E3"]},{"operation":"CNOT","qubits":["E3","A0"]},{"operation":"CNOT","qubits":["E2","E3"]},{"operation":"CNOT","qubits":["E3","E2"]},{"operation":"CNOT","qubits":["E2","E3"]},{"operation":"CNOT","qubits":["E2","E1"]},{"operation":"H","qubits":["E1"]},{"operation":"S","qubits":["E1"]},{"operation":"S","qubits":["E1"]},{"operation":"H","qubits":["E1"]},{"operation":"S","qubits":["E1"]},{"operation":"S","qubits":["E1"]},{"operation":"S","qubits":["E2"]},{"operation":"H","qubits":["E2"]},{"operation":"CNOT","qubits":["E3","E2"]},{"operation":"H","qubits":["E2"]},{"operation":"S","qubits":["E2"]},{"operation":"S","qubits":["E2"]},{"operation":"H","qubits":["E2"]},{"operation":"S","qubits":["E3"]},{"operation":"H","qubits":["E3"]},{"operation":"S","qubits":["E3"]},{"operation":"S","qubits":["E3"]},{"operation":"S","qubits":["E3"]},{"operation":"S","qubits":["B0"]},{"operation":"H","qubits":["B0"]},{"operation":"S","qubits":["B0"]},{"operation":"CNOT","qubits":["E2","E3"]},{"operation":"CNOT","qubits":["E3","E2"]},{"operation":"CNOT","qubits":["E2","E3"]},{"operation":"CNOT","qubits":["E3","A0"]},{"operation":"CNOT","qubits":["A0","E3"]},{"operation":"CNOT","qubits":["E3","A0"]},{"operation":"CNOT","qubits":["E3","E2"]},{"operation":"CNOT","qubits":["E2","E3"]},{"operation":"CNOT","qubits":["E3","E2"]},{"operation":"CNOT","qubits":["E3","A0"]},{"operation":"CNOT","qubits":["A0","E3"]},{"operation":"CNOT","qubits":["E3","A0"]},{"operation":"CNOT","qubits":["E1","E0"]},{"operation":"CNOT","qubits":["E0","E1"]},{"operation":"CNOT","qubits":["E1","E0"]},{"operation":"CNOT","qubits":["E2","E1"]},{"operation":"CNOT","qubits":["E1","E2"]},{"operation":"CNOT","qubits":["E2","E1"]},{"operation":"CNOT","qubits":["E2","E3"]},{"operation":"CNOT","qubits":["E3","E2"]},{"operation":"CNOT","qubits":["E2","E3"]},{"operation":"CNOT","qubits":["A0","E3"]},{"operation":"CNOT","qubits":["E3","A0"]},{"operation":"CNOT","qubits":["A0","E3"]},{"operation":"CNOT","qubits":["E1","E0"]},{"operation":"CNOT","qubits":["E0","E1"]},{"operation":"CNOT","qubits":["E1","E0"]}],"qubit_order":["E0","E1","E2","E3","A0","B0"]},"source_document_hash":"b2228ed0fcc30fef7c47bc8ddb58de30cc82e957c33d6af55f6fda44cbd56622","source_semantic_problem_hash":"b326bf2c8457884a13059c1c4c296a51c9669f3e565ced871f75d6abed0d678d","tau_support":{"logical_qubits":4,"qubit_order":["E0","E1","E2","E3","A0","B0"],"signed_generators":[{"operators":"XIIIZI","phase_exponent_mod_4":0,"qubit_order":["E0","E1","E2","E3","A0","B0"]},{"operators":"IIXYIY","phase_exponent_mod_4":2,"qubit_order":["E0","E1","E2","E3","A0","B0"]}],"support_rank":16},"topology":{"directed":false,"edges":[["A0","B0"],["A0","E3"],["E0","E1"],["E1","E2"],["E2","E3"]],"native_two_qubit_gate":"CNOT","sites":["E0","E1","E2","E3","A0","B0"]}}
